image_id,caption
HMT1,"This is a painted religious icon depicting two figures, likely Jesus and Mary, with halos. They are shown in traditional iconographic style with hands placed over their hearts, which feature a sunburst design with a heart and a cross. The figures are surrounded by a floral background. The icon is framed with a decorative wooden border featuring geometric patterns. Text in Ukrainian is visible on the lower left, and a watermark is present in the lower right. The painting appears to be in good condition with no visible damage."
HMT2,"An icon of a bearded man in a red crown and red robes, holding a book. The icon is in a heavily ornate, dark gold frame with visible damage, including a hole in the background and a small clock face on the left. There are two smaller figures in the background: one on the left and one on the right. Text in Cyrillic is visible at the bottom left and right."
KSU1,"A portrait of a man in traditional attire, including a white fur hat, a white embroidered shirt with a red ribbon, a dark cloak, and green trousers. He stands in a forested area with trees and a dirt path. The painting has visible signs of age and damage, particularly on the right side. There is text in the lower right corner: ""Сушия"" and ""колекція Ір. Брус 1929""."
KSU10,"A painted portrait of a balding man with a grey mustache, wearing a blue coat over a red vest and white shirt. The background is a textured blue. Text at the bottom reads ""Увійтеся брати мої, Т.Г. Шевченко. думайте читайте! 1861."" and ""Сушиця колекція 1814."" The painting shows signs of age and wear."
KSU11,"A painting depicts a rustic cottage with a thatched roof, illuminated by a warm light from its windows, situated on a small island or peninsula. The cottage is surrounded by a body of water, with a small boat resting on the shore. The sky is dark and cloudy, with a bright moon visible. Tall trees stand behind the cottage. The foreground shows a rocky shore with scattered stones and a few yellow flowers. The painting has a textured, impressionistic style. A watermark in the lower-left corner reads ""Сушия колекція""."
KSU12,"A painting of a rural village at dusk. Three houses with thatched roofs and white walls with blue trim are visible. A dirt path leads between them, with a wooden fence in the foreground. The background features trees, including tall cypress trees, and a sky with pink and purple hues. There is a watermark in the lower-left corner that reads ""Сушия КОЛЕКЦІЯ"". The painting appears to be on canvas with visible texture."
KSU13,"A painting depicts a woman in traditional folk attire standing by a wooden well. She holds a bucket and is wearing a white blouse with red embroidery, a dark blue bodice, and a patterned skirt. The setting is a rural landscape with green hills, a dirt path, and trees with yellow blossoms. The sky is partly cloudy. A watermark ""Сушия колекция"" is visible in the lower-left corner. The painting shows signs of age and wear."
KSU14,"A painted wooden panel depicting a winter scene. A person in a red hat sits in a sled pulled by a horse, moving along a snow-covered path. In the background are several snow-covered houses and a church with multiple domes. Trees are covered in snow. A small dog runs on the snow. The scene is set in a village in a forested area. The painting has a dark, weathered frame. There is text in the lower-left corner: ""Сулиця колекція""."
KSU15,"A painting of a snow-covered rural scene. A small, round, thatched-roof house with a chimney emitting smoke is the central focus. The house has a yellow wall and a dark roof. A snow-covered path leads from the foreground to the house. The ground is covered in snow, with tracks visible. A wooden fence is in the foreground on the right. The background shows a distant landscape with trees and other houses. The sky is overcast and grey. There is a watermark in the bottom right corner that reads ""Сушия"" and ""Колекция""."
KSU16,"This is a painting of a Russian Orthodox church complex with white walls and green domes topped with golden crosses. A tall bell tower is visible on the right. The scene is set in a rural landscape with a dirt field, a wooden fence, and two figures standing on a grassy hill in the foreground. There are trees and a small white building in front of the church. The sky is overcast with clouds. The painting has a textured surface and a watermark in the lower right corner that reads ""Сушица колекция""."
KSU17,"A still life painting featuring a large, sliced watermelon on a plate, a bowl of green cucumbers, a bunch of green grapes, a cluster of dark grapes, several green apples, a bottle of wine with a blue label, and a vase with flowers. A small orange pumpkin is on the right. The background is dark. There is a watermark in the bottom right corner that reads ""Сушия колекция"". The painting appears to be on canvas with visible brushstrokes."
KSU18,"This is a painted scene of a village with a prominent church in the center. The church has white walls, blue and green domes, and crosses. It is surrounded by trees and small houses with red and green roofs. A white fence runs along the path. Two groups of people are walking on the path. The painting has a wooden frame. There is text in the lower left corner that says ""Сушия"" and ""колекция"". The painting shows signs of age and wear."
KSU19,"A painting depicts a man in a dark blue military uniform and a black hat, riding a white horse with a red saddle. A woman in a red and blue embroidered dress stands beside him, holding a small wooden bucket. In the background, there are houses, a windmill, trees, and a cloudy sky. The scene is set in a rural landscape. There is text at the bottom in Ukrainian: ""Дівчино Моя, на піжке коня, срубленої нової кріпниці, споного відра!"" and a watermark ""Сушия колекція"" in the lower left corner. The painting shows visible signs of age and wear."
KSU2,"A painting depicts a man in traditional attire sitting on a grassy field, with two cows and a cart nearby. The cart is loaded with a large bundle of hay or straw. The man is looking up at the sky, which is blue with white clouds and filled with numerous black birds. The scene is set in a wide, open field with green grass and small wildflowers. There is a watermark in the bottom right corner that reads ""Сушия КОЛЕКЦИЯ"". The painting appears to be on canvas and shows some signs of age and wear."
KSU20,"This is an oil painting on canvas depicting a still life scene. In the foreground, a large watermelon is cut in half, with a slice on the left and the other half on the right. A bowl holds several slices of watermelon. To the right, a basket contains various fruits including pears, grapes, and a leafy plant. The background shows a landscape with green fields, trees, and a blue sky with clouds. The painting has visible cracks and damage. There is a watermark in the lower left corner that reads ""Сушия колекция""."
KSU21,"This is an oil painting depicting a rural landscape. In the foreground, a man in a white shirt and trousers stands in a plowed field, holding a bundle. To his right, two oxen are harnessed to a plow. In the mid-ground, other figures are working in the field, and a cart is visible. In the background, there are several houses with thatched roofs, trees, and tall, slender trees. The sky is pale and overcast. The painting shows signs of age, including cracks and wear. There is a watermark in the lower-left corner that reads ""Сушия колекція""."
KSU22,"A portrait of a woman in traditional attire, including a dark vest and a white blouse with floral embroidery. She wears a multi-layered necklace with red, orange, and white beads. The background is a landscape with trees and a field. The painting is dated 1931 in the upper right corner. The artist's signature ""Сушия"" and ""Колекция"" are visible in the lower left. The painting shows significant cracking and peeling paint, indicating age and damage."
KSU23,"A portrait of a man with a mustache and a dark, fur-lined hat, wearing a dark coat over a brown shirt. The background is a textured, dark brown. The painting has visible signs of age and wear, including cracks and a rough texture. There is a watermark in the lower-left corner that reads ""Сулиця КОЛЕКЦІЯ"" in a stylized font."
KSU24,"A painting of a rural landscape featuring two thatched-roof cottages with white walls, set in a green field. A dirt path leads to the houses, with a birch tree and other trees in the background. A small figure stands near the house. The sky is light and cloudy. The painting has visible signs of age and damage, including cracks and paint wear. There is a signature in the lower right corner and a watermark in the lower left corner."
KSU25,"This is an oil painting on canvas depicting a rural scene. In the foreground, a woman in a white shirt and red skirt bends over a wooden trough, feeding chickens. A young boy stands nearby. To the left is a well with a bucket hanging from a wooden pole. In the background, two houses with thatched roofs are visible, surrounded by trees and a wooden fence. The sky is pale and overcast. The painting shows signs of age, including cracks and wear. There is a watermark in the lower-left corner that reads ""Сушия КОЛЕВСЬЯ""."
KSU3,"This is a painting of a rural landscape. In the foreground, a river with two swans swims. A wooden bridge crosses the river, with a woman in a red skirt standing on it. A horse-drawn cart is on the path. Several houses with thatched roofs are scattered across the field. In the background, a church with blue domes is visible. The sky is blue with white clouds. The painting is in a dark frame. There is a watermark in the lower right corner that says ""Сушия колекция""."
KSU4,"A portrait of an elderly man with a white beard and mustache, wearing a dark fur hat and a dark coat. He is looking directly at the viewer. The background is a plain, textured grey. There is a watermark in the lower-left corner that reads ""Сулия колекція"" in Cyrillic script. The painting shows signs of age and wear, including visible brushstrokes and some damage."
KSU5,"This is an oil painting on canvas depicting a forest scene. The painting shows numerous birch trees with white bark and dark markings, their branches reaching upwards. The trees are in the foreground and middle ground, with some leaves falling onto the ground and a small stream or pond in the lower part of the painting. The background shows a distant landscape with more trees and a pale sky. The painting has a warm, autumnal color palette. There is a watermark in the lower right corner that reads ""Сушица КОЛЕКЦІЯ"" in Cyrillic script. The painting appears to be in good condition with no visible damage."
KSU6,"A portrait of a bald man with a mustache, wearing a light-colored shirt with dark embroidery and a dark cloak draped over his shoulder. He is seated at a table with a quill pen, inkwell, and a book. The background is a textured, brownish wall. A watermark in Cyrillic script is visible in the lower-left corner. The painting appears to be oil on canvas, with visible brushstrokes."
KSU7,"A portrait of a balding man with a prominent mustache, wearing a dark coat over a brown shirt. He is looking directly at the viewer. The background is a textured, dark olive green. There is a watermark in the lower-left corner that reads ""Сушия"" and ""колекція"" in a cursive script. The painting appears to be oil on canvas, showing signs of age and wear."
KSU8,"A painting depicting a rural landscape with a small house, a thatched roof, and a wooden fence. The house is surrounded by green fields with hay bales, trees, and a body of water with swans. The sky is painted with soft, wavy clouds. The painting is in a dark red frame. There is a watermark in the bottom right corner that reads ""Сушица КОЛЕКЦІЯ"". The painting shows signs of age and wear."
KSU9,"A painting depicts a rural scene with three figures. A man in a red coat and black hat sits on a black horse, holding a sword. A woman in a blue and red dress stands nearby, covering her face. An older man in a light blue shirt and dark trousers stands to the left, looking up at the man on the horse. The background shows a village with thatched-roof houses and trees. The sky is pink and blue. Text in the lower right corner reads: ""Виде коня за поводи та плache Ярина; старий батько іде рядом, наставляє сина."" A watermark ""Сушия колекция"" is in the lower left. The painting shows visible signs of age and wear."
KYD1241,"A painted religious portrait of Jesus Christ with long dark hair and a beard, wearing a dark robe with a red garment over it. He has a golden halo above his head and is holding his chest where a golden heart with a cross is depicted. The background is a blue sky with a yellow halo. The painting shows visible signs of age and wear, including cracks and paint damage. There is a small red mark on the left hand and a white bandage on the right hand."
KYD1242,"A painted religious portrait of a woman with a halo, wearing a red garment with a heart symbol on her chest, holding flowers. She has dark hair and a white veil. She is holding a bouquet of white and red flowers. The background is blue. There is a yellow halo above her head. The painting appears to be on a textured surface with visible signs of age and wear."
KYD1243,"A weathered, dark wooden surface with a large, faded green cross painted on it. The cross has a red outline and is set against a dark, textured background with visible cracks, peeling paint, and small patches of yellow and brown. The surface shows signs of age and damage. There is faint, illegible text at the bottom."
KYD1244,"This is a damaged, aged religious icon depicting the Resurrection of Christ. The central figure is Jesus Christ, standing with a large wooden cross. To his left is a woman in a green and red robe with a crown, and to his right is a man in a dark robe and crown, holding a staff. Another man in a green and red robe stands to the right of the central figure. The background is dark blue with radiating lines. The icon has visible cracks and paint damage. Text in Cyrillic script is visible at the top: ""ВОЗВЕДЕНІЕ, КРЕСТ"" (Resurrection, Cross) on the left and ""ГОСПОДАНА"" (Lord) on the right."
KYD1245,"This is a damaged, painted icon depicting two figures. On the left, a woman in a red hood and dark robe holds a child with a halo. On the right, a man in a dark robe and a red, patterned hat holds a book. Both figures have halos. The background is dark red with visible cracks and paint damage. There is gold text in the upper right corner, but it is illegible. The icon is in a vertical format."
KYD1246,"A religious icon depicting a woman in a red robe with a hood, holding a child. The woman has a solemn expression and is holding a plant with flowers. The child is holding a cross. The background is dark and textured. There is text at the bottom of the image. The icon appears to be old and damaged."
KYD1247,"A wooden icon of a woman with dark hair, a yellow halo, and a green robe. She holds a small golden cross in her right hand and a bundle of grass in her left. She wears a pearl necklace and a cross earring. The background is a dark red, weathered wood with visible cracks and damage. The top of the icon has some faded Greek text."
KYD1248,"This is a vertical oil painting on canvas depicting a landscape. The scene features a river with a small island in the foreground, where two birch trees stand. One tree has white bark with black markings, and the other has sparse, yellowish leaves. A figure in dark clothing stands on the right side of the painting. The background shows green hills and a distant forest. The sky is light with some blue and white. There is text at the bottom right: ""ЕТНОГРАФІЧНА КОЛЕКЦІЯ КРОВЕЦЬ krovets.com.ua"". The painting shows visible signs of age and wear."
KYD1249,"This is a painted folk art scene depicting three figures in a rural setting. A man in a red coat and black hat sits on a dark horse, holding a rifle. To his left, a man in a white shirt and blue pants stands, looking up. To the right, a woman in a blue and red embroidered dress stands with her hand on her face. In the background, there are houses with green roofs and a church with golden domes. The painting shows signs of age and damage. Text in Ukrainian is visible at the bottom."
KYD1250,"A painted mural depicts a rural village scene. A man in a red coat and black hat stands beside a white horse with red and green decorations. A woman in a red and white dress stands near a water pump. The background features thatched-roof houses, green trees, and a pond with swans. The sky is blue with birds. A watermark ""ЕТНОГРАФИЧНА КОЛЕКЦІЯ КРОВЕЦЬ kroves.com.ua"" is visible in the lower-left corner."
KYD1251,"A painting depicting a group of people in traditional folk attire by a river. A man in a boat plays a lute, another holds a long pole. Several women and a child are gathered on the bank, some sitting, one cooking. Trees and hills are in the background under a cloudy sky. The painting is on wood with visible grain and some damage. Text in the lower left corner reads ""ЕТНОГРАФИЧНА КОЛЕКЦІЯ КРОВЕЦЬ krovets.com.ua""."
KYD1252,"A painted portrait of a woman in traditional attire, sitting on a wooden chair outdoors. She wears a blue dress with white sleeves embroidered with red patterns, a dark blue vest, and a floral headpiece. She is adorned with multiple necklaces. The background features a garden with roses, a vase, and a cloudy sky. The painting has a red border and visible signs of aging and damage. A watermark at the bottom reads ""ЕТНОГРАФІЧНА КОЛЕКЦІЯ КРОВЕЦЬ krovets.com.ua""."
KYD1253,"A painting of a lakeside village scene. Several houses with brown roofs are on the shore, surrounded by trees. A wooden dock extends into the water. Several white swans are swimming in the lake. The water is blue and reflects the sky. A hill with trees and a church with golden domes is visible in the background. The sky is light blue and white. There is a watermark in the bottom right corner that reads ""ЕТНОГРАФІЧНА КОЛЕКЦІЯ КРОВЕЦЬ krovets.com.ua"". The painting appears to be on wood and shows signs of age and wear."
KYD1254,"A painted portrait of a man and a woman in traditional attire, surrounded by flowers. The man wears a black hat and a dark jacket over a white shirt with a red tie. The woman wears a floral headband, a dark vest over a white blouse with embroidery, and a heavy necklace of silver coins. They are set against a dark, textured background with painted flowers in the foreground. A watermark is visible in the bottom right corner."
KYD1255,"A portrait of an elderly woman in traditional rural attire, seated on a wooden stool in a garden setting. She wears a brown vest over a white blouse with blue floral embroidery, a blue skirt, and dark boots. A red ribbon is tied in her hair. Behind her, a cow is drinking from a wooden trough. A small white house is visible in the background, surrounded by trees and greenery. The painting shows signs of age and wear. A watermark at the bottom reads ""ЕТНОГРАФІЧНА КОЛЕКЦІЯ КРОВЕЦЬ krovets.com.ua""."
KYD1256,"A portrait of a bald man with a long, grey mustache, wearing a dark coat over a blue shirt and a brown sash. The background is a textured, dark grey. The painting shows visible signs of age and wear, including cracks and fading. Text at the bottom reads ""1814-1861 2. 14. НИСЕСТЕНКО 1925 2 К"" and a watermark ""ЕТНОГРАФІЧНА КОЛЕКЦІЯ КРОВЕЦЬ krovets.com.ua""."
KYD1257,"This is a damaged, aged painting depicting a scene with several figures. On the right, a portrait of a man in a dark hat and coat is visible. Below the portrait, the text ""Т.Г. ШЕВЧЕНКО"" and ""УЧІТЕ СЯ БРАТИ МОЇ ДУМАЙТЕ ЧИТАЙТЕ....!"" is written. In the center, two figures are seated by a fire, one playing a stringed instrument. In the background, a man on a white horse stands near a body of water. A woman in a white shirt and red skirt is on the left. The painting has a textured, peeling surface. In the bottom right corner, there is a logo and text ""ЕТНОГРАФІЧНА КОЛЕКЦІЯ КРОВЕЦЬ krovets.com.ua""."
KYD1258,"A painted portrait of a man in a dark, double-breasted military uniform with gold trim and buttons. He has short brown hair, a mustache, and is looking directly at the viewer. The background is a textured, muted blue and beige wall. There is a watermark in the bottom right corner that reads ""ЕТНОГРАФІЧНА КОЛЕКЦІЯ КРОВЕЦЬ krovets.com.ua"". The painting shows signs of age and wear."
KYD1259,"A painted portrait of a woman with dark hair, wearing a floral headband, a dark blue vest, and a white embroidered blouse. She wears a multi-layered necklace with beads. The background is a weathered, textured wall with a small window. A watermark is visible at the bottom right."
KYD1260,"A painted religious icon of a woman, likely a saint, wearing a crown and a dark green robe with a red cloak. She holds a golden chalice in her left hand and a flower in her right. She has long dark hair and a white collar. The background is a muted, textured brown. There is text at the top in Cyrillic script, and a watermark at the bottom right. The image shows signs of age and damage."
KYD1261,"This is a damaged, circular wooden icon depicting a bearded man with a white halo, holding a staff and a dove. He wears a green and red robe. Below him are two small, painted heads. The icon has visible wood grain and cracks. The background is dark with green foliage. There is text in Ukrainian at the bottom: ""ЕТНОГРАФІЧНА КОЛЕКЦІЯ КРОВЕЦЬ"" and a website address. The icon is in a circular frame with a gold border."
KYD1264,"This is a damaged, two-part icon of the Virgin Mary holding the infant Jesus. The Virgin wears a red veil and a blue garment, with a gold necklace. The child is dressed in white and green. The background is a gold field with visible cracks and damage. Above the Virgin, the Greek letters ""ΜΡ"" (Mary) and ""ΧΡ"" (Christ) are visible. The icon is split into two panels, with the right panel showing a visible crack. The left panel shows the Virgin's hands and the child's hands. The icon is painted on wood, with visible wood grain and damage."
KYD1265,"A portrait of a balding man with a prominent mustache, wearing a dark coat over a red shirt and white collar. The painting is on canvas with visible cracks and age-related damage. The background is a dark, textured brown. A watermark is present in the bottom right corner reading ""ЕТНОГРАФІЧНА КОЛЕКЦІЯ КРОВЕЦЬ krovets.com.ua""."
KYD1266,"This is a painting depicting a battle scene at sunset. Several figures on horseback are engaged in combat, with some on white and black horses. In the background, a castle is visible on a hill. The sky is filled with clouds in shades of orange, red, and grey. At the bottom of the painting, there is text in Cyrillic script: ""Бій і Богуна з Яремою Вишневецьким"". The painting is signed ""Ігор"" and dated ""1987р."" in the bottom right corner. The artwork shows visible brushstrokes and some areas of wear."
KYD1267,"A painting depicting a chaotic battle scene at night, with numerous figures on horseback engaged in combat. The setting is a forested area with a stream, and the sky is dark with a large moon and clouds. The figures are dressed in colorful, traditional attire, some with swords and bows. In the foreground, a rider is crossing a stream. The painting has visible text at the bottom: ""Тарасова ніч. 1630р. 22 травня"" and a signature in the lower right corner. The artwork shows signs of wear and tear, including a black crack in the lower right corner."
KYD1679,"This is a wooden icon depicting the Virgin Mary and the infant Jesus. Mary is shown wearing a red veil and a red robe, with a golden halo. She is holding the child, who is dressed in a white tunic and a dark cloak, also with a golden halo. The background is decorated with floral patterns in red, green, and white. The icon shows visible wood grain and some paint damage. There is text in Cyrillic at the bottom right, ""ЕТНОГРАФІЧНА КОЛЕКЦІЯ КРОВЕЦЬ""."
KYD1680,"This is a damaged, painted religious icon depicting the Virgin Mary holding the infant Jesus. She is shown in a dark, hooded garment with a red robe, and the child is in a light-colored garment. Both figures have halos. The background is a dark red with a golden arch above the figures. The icon is framed by a dark border with red drapery on the sides. There is visible damage, including cracks and paint loss, particularly on the figures and the background. The image has a watermark at the bottom that reads ""ЕТНОГРАФІЧНА КОЛЕКЦІЯ КРОВЕЦЬ"" with a geometric symbol."
