image_id,caption
KYD1681,"This is a painted icon of Jesus Christ, likely from the 19th century. He is depicted with long dark hair and a halo, wearing a black robe over a red garment. He holds a large, round, wooden object, possibly a drum or a bowl, and raises his right hand in a gesture. The background is a red curtain with green drapery on the sides. The icon is in poor condition with visible cracks and paint damage. There is text at the bottom right: ""ЕТНОГРАФІЧНА КОЛЕКЦІЯ КРОВЕЦЬ""."
KYD1682,"This is a damaged, old religious icon depicting a woman with a halo, likely a saint, wearing a red robe with gold trim and a dark inner garment. She has her hands clasped in prayer. To her right, a crucifix is visible. The background is dark green, and the icon has a thick, worn red border. The image shows visible paint cracking and peeling. Text at the bottom reads ""ЕТНОГРАФИЧНА КОЛЕКЦІЯ КРОВЕЦЬ"" (Ethnographic Collection Krovcev)."
KYD1683,"This is a damaged, aged religious icon depicting the Virgin Mary holding the infant Jesus. The icon is painted on a dark, weathered wooden surface with visible cracks and peeling paint. Mary wears a red veil and a dark blue garment, with a gold crown and a star on her head. She holds a small child, who is dressed in white and gold. The background is dark and textured. There is text at the top and a watermark at the bottom right that reads ""ЕТНОГРАФІЧНА КОЛЕКЦІЯ КРОВЕЦЬ"". The icon shows signs of significant age and deterioration."
KYD1684,"This is a damaged, aged painting depicting a reclining figure, likely a saint, with a halo. The figure is on a dark surface, possibly a bed, with a skull and a red cloth nearby. In the background, there is a red curtain, a rooster, and a cross. A vase with flowers is on the left. The painting is in poor condition with visible cracks and dark spots. There is text in the bottom right corner: ""ЕТНОГРАФІЧНА КОЛЕКЦІЯ КРОВЕЦЬ""."
KYD1685,"This is a painted wooden icon depicting the Virgin Mary holding the infant Jesus, with two men kneeling before her. The Virgin wears a red robe with a gold halo and a crown, and the infant Jesus is dressed in a white and blue garment. The two men are dressed in dark robes with red trim. The background is dark red with decorative elements. The icon is visibly damaged with cracks and holes. There is text in the bottom right corner that reads ""ЕТНОГРАФИЧНА КОЛЕКЦІЯ КРОВЕЦЬ""."
KYD1686,"A close-up of a wooden object with vertical ridges, likely a traditional tool such as a washboard or a wooden tool. The wood has a dark, weathered appearance with visible grain and some discoloration. The surface is textured with deep grooves running vertically. There is no visible text or other objects in the image. The object appears to be made of wood and is in a state of use, showing signs of wear and age."
KYD1687,"A damaged, aged religious icon depicting a bearded man with a halo, likely Jesus Christ, in a seated pose. He wears a red garment over a dark robe and holds a small cross. His right hand is raised in a gesture. The background is dark red with gold ornamental borders. The icon shows significant paint cracking and peeling. Text at the bottom reads ""ЕТНОГРАФІЧНА КОЛЕКЦІЯ КРОВЕЦЬ""."
KYD1688,"This is a damaged, aged religious painting depicting the Virgin Mary holding the infant Jesus. She is shown with a dark veil and red garment, and the child is dressed in white. Both figures have golden halos. The image is set against a dark red background with ornate golden borders. The painting is visibly cracked and worn, with visible damage to the surface. There is text at the bottom right that reads ""ЕТНОГРАФІЧНА КОЛЕКЦІЯ КРОВЕЦЬ"" (Ethnographic Collection Krovcev)."
KYD1689,"This is a damaged, aged icon of the Virgin Mary holding the infant Jesus. The Virgin wears a red veil and robe, and the child is dressed in green and yellow. The icon shows visible signs of age and damage, including cracks, peeling paint, and holes in the surface. The background is a gold-leafed, textured surface. There is text in Cyrillic script at the bottom right, which reads ""ЕТНОГРАФІЧНА КОЛЕКЦІЯ КРОВЕЦЬ""."
KYD1690,"This is a damaged, two-part wooden icon depicting the Virgin Mary holding the infant Jesus. The Virgin is shown with a golden halo and a red and green robe, while the child has a simple halo and a striped garment. The background is dark with floral motifs. The icon is visibly cracked and has numerous holes and paint damage. A watermark at the bottom right reads ""ЕТНОГРАФІЧНА КОЛЕКЦІЯ КРОВЕЦЬ""."
KYD1691,"This is a damaged, aged icon of the Virgin Mary holding the infant Jesus. The Virgin wears a red robe with gold trim and a golden halo, and the child is dressed in a green garment. The icon is painted on a dark, weathered surface with visible cracks and peeling paint. In the upper left, faint Greek letters are visible. A watermark at the bottom right reads ""ЕТНОГРАФИЧНА КОЛЕКЦІЯ КРОВЕЦЬ""."
KYD1692,"A painted wooden icon depicting a figure in armor and a red cape riding a horse, with a red dragon at the bottom. The figure is holding a sword and has a halo. The background is dark with yellow stars. The painting is on a wooden surface with visible grain and cracks. There is text in Cyrillic at the top and bottom. The bottom text reads ""ЕТНОГРАФІЧНА КОЛЕКЦІЯ КРОВЕЦЬ""."
KYD1693,"This is a painted wooden icon depicting the Virgin Mary holding the infant Jesus. Mary wears a red veil and a red robe, with a gold halo behind her. The infant Jesus is dressed in a white tunic and a dark cloak, also with a halo. The background is a dark red with floral patterns and gold accents. The icon shows visible signs of age and damage, including cracks and paint loss. There is text in Cyrillic script at the bottom right, which reads ""ЕТНОГРАФИЧНА КОЛЕКЦИЯ КРОВЕЦЬ""."
KYD1694,"A religious icon depicting a saint on horseback, holding a staff and a red cloth, with a halo above his head. The saint is riding a horse that is attacking a green dragon. In the background, a small figure stands on a rocky outcrop. The image has a dark background and a red border. There is text at the top and bottom of the image. The bottom text reads ""ЕТНОГРАФІЧНА КОЛЕКЦІЯ КРОВЕЦЬ"". The image shows visible damage, including cracks and peeling paint."
KYD1695,"This is a damaged, aged religious painting depicting the Virgin Mary holding the infant Jesus. The Virgin is shown in a dark blue or black veil, with a yellow garment, and the child is in a light-colored robe. The background is a dark red with black decorative elements. The painting is on a wooden surface with visible cracks and paint damage. There is text in the lower right corner: ""ЕТНОГРАФІЧНА КОЛЕКЦІЯ КРОВЕЦЬ""."
KYD1696,"A painted icon of a crowned female figure, likely a saint, holding a chalice in her right hand and a sword in her left. She wears a green robe with gold trim and a dark cloak. A green halo with gold dots surrounds her head. The background is a dark red, textured surface with small holes. The image shows signs of age and damage, including cracks and paint loss. Text at the bottom right reads ""ЕТНОГРАФІЧНА КОЛЕКЦІЯ КРОВЕЦЬ""."
KYD1697,"This is a damaged, painted icon of the Virgin Mary holding the infant Jesus. She wears a red veil and a red robe with gold trim, and the child is dressed in white and green. Both figures have halos. The background is dark with painted pinecones. The icon is on a wooden surface with visible holes and cracks. There is text in Cyrillic at the bottom right: ""ЕТНОГРАФІЧНА КОЛЕКЦІЯ КРОВЕЦЬ""."
KYD1698,"This is a damaged, wooden icon of a female figure, likely a saint, with a golden halo. She wears a crown and a brown robe with a gold necklace. She holds a golden chalice in her right hand. The background is dark blue. The icon shows visible cracks and peeling paint. At the top, there is partially visible text in Cyrillic script. A watermark at the bottom reads ""ЕТНОГРАФИЧНА КОЛЕКЦІЯ КРОВЕЦЬ""."
KYD1699,"This is a damaged, aged religious icon depicting a woman with dark hair, wearing a crown and a robe, holding a chalice. She is shown in a frontal pose against a dark, textured background. The icon has visible cracks and peeling paint, particularly on the right side. In the upper right corner, there is text in Cyrillic script. A watermark at the bottom reads ""ЕТНОГРАФІЧНА КОЛЕКЦІЯ КРОВЕЦЬ""."
KYD1700,"A weathered, painted icon of a bearded man in a crown, likely a religious figure. He wears a light-colored robe and holds a small object in his right hand. The background is a mottled, aged surface with visible cracks and rust spots. The image is in a style typical of Eastern Orthodox icons. Text at the bottom reads ""ЕТНОГРАФІЧНА КОЛЕКЦІЯ КРОВЕЦЬ"" (Ethnographic Collection Krovcev)."
KYD1701,"This is a damaged, weathered wooden icon depicting two figures. On the left is a bearded man in red and gold vestments with a mitre, holding a book. On the right is a woman in red robes holding a child. Both figures have golden halos. The background is blue with visible cracks. The text ""НИКОЛАЙ ЛИР"" is written above the figures. A watermark ""ЕТНОГРАФІЧНА КОЛЕКЦІЯ КРОВЕЦЬ"" is in the bottom right corner. The icon shows significant paint cracking and peeling."
KYD1702,"This is a damaged, painted wooden icon depicting three figures. On the left is a woman in a red head covering, likely the Virgin Mary, with a halo. In the center is a young child, possibly Jesus, also with a halo. On the right is an older man with a long white beard and hair, likely Saint John the Baptist, raising his right hand in a gesture. The background is dark blue with red script. The icon is in poor condition with visible cracks and paint damage. A watermark in the bottom right corner reads ""ЕТНОГРАФИЧНА КОЛЕКЦИЯ КРОВЕЦЬ""."
KYD1703,"This is a damaged, split wooden icon depicting the Virgin Mary holding the infant Jesus. Mary wears a red robe with a green veil and a gold halo, while the child is in a white garment with a yellow sash. Both figures have halos. The background is ornate with gold and green patterns. A vertical crack runs down the center of the icon. The image is in a traditional Orthodox style. The text ""ЕТНОГРАФИЧНА КОЛЕКЦІЯ КРОВЕЦЬ"" is visible in the bottom right corner."
KYD1704,"This is a damaged, two-part wooden icon depicting the Virgin Mary holding the infant Jesus. Mary wears a red robe with gold trim and a green veil, and has a golden halo. The child is dressed in white and holds a small object. Both figures have golden halos. The background is dark with painted pomegranates and leaves. The icon is split down the middle by a vertical crack. The bottom right corner has a watermark: ""ЕТНОГРАФИЧНА КОЛЕКЦІЯ КРОВЕЦЬ""."
KYD1705,"This is a damaged, two-part wooden icon depicting a religious scene. On the left, a figure in a green robe, likely Jesus, holds a cross with the inscription ""Iesu"" and ""Ave"" visible. In the center, a young person in a red robe and yellow collar is being crowned by a figure in a red robe and green cloak. To the right, an older man with a white beard, likely a saint, holds a staff. Above them, a dove flies over a golden pyramid. The icon shows visible cracks and paint damage. Text at the bottom reads ""ЕТНОГРАФІЧНА КОЛЕКЦІЯ КРОВЕЦЬ""."
KYD1706,"A painting of a female figure on a white horse, holding a spear. The figure wears a red cloak and a helmet, and the horse is adorned with a decorative bridle. The background is dark with streaks of red paint. The painting is damaged with vertical red paint streaks. Text at the bottom reads ""ЕТНОГРАФИЧНА КОЛЕКЦІЯ КРОВЕЦЬ""."
KYD1707,"This is a wooden icon depicting a figure, likely Jesus Christ, with a halo. The figure has long dark hair and is wearing a red robe with gold trim over a blue garment. The figure is holding a cross with a crucified figure on it. The background is orange with black floral patterns. There is a vertical crack down the center of the icon. The bottom right corner has text in Cyrillic: ""ЕТНОГРАФІЧНА КОЛЕКЦІЯ КРОВЕЦЬ"". The icon shows signs of age and damage, including peeling paint and cracks."
KYD1708,"This is a damaged, wooden icon depicting the Virgin Mary holding the infant Jesus. Mary wears a red robe with a green veil and a red head covering, and the child is dressed in white. Both figures have golden halos. The background is a gold field with two green circular designs on either side. The icon shows significant vertical cracks and dark stains, indicating age and damage. The bottom right corner has a watermark in Cyrillic: ""ЕТНОГРАФИЧНА КОЛЕКЦІЯ КРОВЕЦЬ""."
KYD1709,"This is a painted wooden icon depicting a saint on horseback. The saint, wearing a crown and a red cloak, rides a white horse that is in the act of killing a dragon. The scene is set against a background with clouds and a landscape. The icon is framed by a decorative border with red and black floral motifs. The painting is visibly damaged, with cracks and paint loss. There is text in Cyrillic script at the top and bottom of the image. The bottom text reads ""ЕТНОГРАФІЧНА КОЛЕКЦІЯ КРОВЕЦЬ""."
KYD1710,"This is a damaged, wooden icon of the Virgin Mary holding the infant Jesus. The Virgin wears a red robe with gold trim and a golden halo, and the child is dressed in white. The icon is set against a dark background with a red border. The image shows visible cracks and paint damage, particularly on the left side. There is gold lettering on the halo and the background, and a watermark at the bottom right reads ""ЕТНОГРАФІЧНА КОЛЕКЦІЯ КРОВЕЦЬ""."
KYD1711,"This is a wooden icon depicting the Virgin Mary holding the infant Jesus. Mary wears a red robe with a blue undergarment and a red veil, and she has a golden halo. The child is dressed in a yellow garment and has a golden halo. Both figures have halos. The background is red with gold patterns and black flowers. There is a vertical crack down the center of the icon. The bottom right corner has text in Cyrillic: ""ЕТНОГРАФИЧНА КОЛЕКЦІЯ КРОВЕЦЬ"". The icon shows signs of age and wear."
KYD1712,"This is a painted wooden icon depicting the Virgin Mary holding the infant Jesus. She wears a red robe with gold trim and a jeweled crown, and the child wears a simple white garment. Both are surrounded by a golden halo. The background is a rich red with floral patterns in green and gold. The icon shows signs of age and damage, including cracks and paint wear. Text in Cyrillic is visible in the upper right corner and at the bottom right. The image is from the ""ЕТНОГРАФИЧНА КОЛЕКЦІЯ КРОВЕЦЬ"" collection."
KYD1713,"This is a damaged, wooden icon of a crowned female figure, likely a saint, with a golden halo. She wears a dark robe with gold trim and a red cloak, holding a chalice. The background is ornate with gold and green floral patterns. The icon shows visible vertical cracks and paint damage. Text at the bottom reads ""ЕТНОГРАФІЧНА КОЛЕКЦІЯ КРОВЕЦЬ""."
KYD1714,"This is a wooden icon of the Virgin Mary, painted on a wooden panel with visible vertical grain and cracks. The central figure is a woman with dark hair, wearing a dark veil and a dark robe with red and gold details. She is depicted with a sorrowful expression, holding a small object. The icon is framed by a circular halo with green leaves and pink roses. The background is a dark green and gold. There is red text at the top of the halo, and a watermark at the bottom right reads ""ЕТНОГРАФИЧНА КОЛЕКЦІЯ КРОВЕЦЬ"". The icon shows signs of age and damage, including peeling paint and cracks."
KYD1715,"This is a damaged, wooden icon of the Virgin Mary holding the infant Jesus. The central figures are the Virgin Mary in a red robe and blue garment, and the Christ Child in a white tunic. Both have golden halos. The icon is set within a decorative octagonal frame with floral motifs and a central vertical crack. The background is dark. The image is visibly damaged with cracks and paint loss. Text in Cyrillic is visible at the bottom right, reading ""ЕТНОГРАФІЧНА КОЛЕКЦІЯ КРОВЕЦЬ""."
KYD1716,"This is a damaged, painted religious icon depicting a central figure, likely Jesus Christ, seated and holding a chalice. He is flanked by two angels. The central figure is bare-chested, wearing a red cloth, and has a halo. The angel on the left holds a staff, and the angel on the right holds a chalice. The background is dark red with green leaves. There is text in Cyrillic script at the top and a watermark at the bottom. The icon shows significant cracking and damage."
KYD1717,"This is a wooden icon of a bearded man in religious attire, likely a bishop, with a golden halo. He wears a red and gold mitre and a red robe with gold trim. He holds a book in his left hand and makes a gesture with his right hand. The background is a wooden panel with a golden halo and two black floral motifs. The icon shows signs of age and damage, including cracks and paint loss. Text in Cyrillic is visible at the bottom right."
KYD1718,"This is a painted wooden icon of Saint Nicholas, a 17th-century Eastern Orthodox icon. He is depicted with a white beard, wearing a red mitre and red vestments with gold trim. He holds a book in his left hand and raises his right hand in a gesture of blessing. A golden halo surrounds his head. The background is red with floral patterns. The icon shows signs of age and damage, including cracks and paint wear. Text is visible at the top and bottom of the image."
KYD1719,"This is a wooden icon of a saint, likely Saint John the Baptist, with a golden halo. The figure is wearing a red robe over a dark garment and holds a staff. The background is ornate with gold and red floral patterns. The icon shows visible wood grain and cracks. Text in Cyrillic is visible on the halo and in the bottom right corner. The image has a watermark ""ЕТНОГРАФИЧНА КОЛЕКЦІЯ КРОВЕЦЬ""."
KYD1720,"This is a weathered, painted wooden icon depicting a religious scene. A central figure, likely the Virgin Mary, is shown with a golden halo and a red garment. To her left, a figure in red drapery holds a golden crown, while to her right, a bearded man in a green robe holds a golden crown. Above them, a yellow triangular shape with a white dove is visible. The background is dark. The image shows significant paint cracking and peeling. At the bottom right, there is a watermark that reads ""ЕТНОГРАФИЧНА КОЛЕКЦІЯ КРОВЕЦЬ""."
KYD1721,"This is a wooden icon of the Virgin Mary, likely from the 18th or 19th century, with a central depiction of the Virgin holding the Christ Child. The icon is painted on wood with visible vertical cracks and damage. The Virgin is wearing a red veil and green robe, with a golden halo. The Christ Child is depicted in a smaller oval within the Virgin's garment. The background is red with gold and green floral patterns. There is text in Cyrillic script at the top and bottom of the image. The bottom right corner has a logo and text ""ЕТНОГРАФІЧНА КОЛЕКЦІЯ КРОВЕЦЬ""."
KYD1722,"This is a damaged, wooden icon of the Virgin Mary holding the infant Jesus. She wears a red robe and a golden halo, with a green and white floral ornament on her left side. The infant Jesus is depicted in a green robe with a golden halo. The icon is painted on a wooden surface with visible vertical grain and cracks. There is a dark, vertical streak running down the center of the image. The background is a golden-yellow with a floral pattern. The bottom right corner has a watermark that reads ""ЕТНОГРАФИЧНА КОЛЕКЦІЯ КРОВЕЦЬ""."
KYD1723,"This is a damaged, two-part wooden icon of Christ Pantocrator. He is depicted with a golden halo, wearing a red and gold robe, and holding an open book with Greek text. The icon is surrounded by green leaves and red apples. The background is dark and weathered. There is a watermark at the bottom right that reads ""ЕТНОГРАФІЧНА КОЛЕКЦІЯ КРОВЕЦЬ""."
KYD1724,"This is a wooden icon of a saint, likely a bishop, depicted in a traditional Orthodox style. The saint wears a dark, ornate mitre and a dark robe with gold embroidery, including a cross and floral patterns. He holds a book in his left hand and a small, decorated shield in his right. The background is a dark red with gold floral patterns. The icon is split down the middle, with a vertical crack running through the center. At the top, there is text in Cyrillic script. The bottom right corner has a watermark that reads ""ЕТНОГРАФІЧНА КОЛЕКЦІЯ КРОВЕЦЬ"". The icon shows signs of age and damage, including visible cracks and wear."
KYD1725,"This is a wooden icon depicting the Virgin Mary holding the infant Jesus. Mary wears a red veil and a red robe with gold trim, and the child is dressed in white. Both figures have golden halos. The background is dark with painted flowers and pomegranates. The icon shows visible wood grain and damage, particularly on the Virgin's face and hands. There is text in the bottom right corner: ""ЕТНОГРАФІЧНА КОЛЕКЦІЯ КРОВЕЦЬ""."
KYD1726,"This is a damaged, painted icon of the Virgin Mary holding the infant Jesus. The Virgin wears a red robe and a red veil, with a golden halo. The child is dressed in a light-colored garment and has a golden halo. Both figures have halos. The background is dark with green leaves and pink flowers. The icon shows visible damage, including cracks and paint loss. There is text in the bottom right corner: ""ЕТНОГРАФИЧНА КОЛЕКЦІЯ КРОВЕЦЬ""."
KYD1727,"A wooden icon of a bearded man in a black hat and dark robes, holding a scroll. He stands before a golden halo and ornate golden background with a floral motif. To his left is a small table with a book. The background is a red curtain. The image has visible damage and the text ""ЕТНОГРАФІЧНА КОЛЕКЦІЯ КРОВЕЦЬ"" is visible in the bottom right corner."
KYD1728,"This is a damaged, oval-shaped religious icon depicting the Virgin Mary holding the infant Jesus, with the angel Gabriel to her right. The Virgin wears a green robe and a light-colored head covering, and the infant Jesus is wrapped in a white cloth. Both are surrounded by golden halos. The background is a dark red with a gold border. The icon is painted on wood, showing visible cracks and wear. There is Cyrillic text on the left side and a watermark at the bottom right that reads ""ЕТНОГРАФИЧНА КОЛЕКЦІЯ КРОВЕЦЬ""."
KYD1729,"This is a damaged, aged religious icon depicting a female figure, likely a saint, with a golden halo. She wears a dark blue or green robe with a red cloak and holds a chalice in her hands. The background is ornate with green floral patterns and gold. The icon is on a wooden surface with visible cracks and paint drips. Text in Cyrillic is visible on the halo and in the bottom right corner. The image shows signs of significant deterioration."
KYD1730,"This is a painted wooden icon depicting the Virgin Mary holding the infant Jesus. The central oval frame shows Mary with a red veil and a green garment, holding the child who is holding a book. The icon is surrounded by a blue and orange star-shaped border with four angels at the corners. The background is dark, and the painting shows signs of age and damage. There is text in Cyrillic at the bottom right, ""ЕТНОГРАФІЧНА КОЛЕКЦІЯ КРОВЕЦЬ""."
KYD1731,"A damaged, aged painting of an angel with large wings, wearing a crown and a red cloak, holding a sword. The figure is depicted in a dark, cloudy background. The painting is visibly cracked and damaged, with a vertical crack running down the center. There is text in the bottom right corner: ""ЕТНОГРАФІЧНА КОЛЕКЦІЯ КРОВЕЦЬ""."
KYD1732,"This is a damaged, painted icon of the Virgin Mary holding the infant Jesus. The Virgin wears a red and blue robe with gold trim, and the child is in a yellow garment. Both are under a golden halo. The background features a black and gold pattern with a zigzag design. The icon is in poor condition with visible cracks and paint damage. There is text in Cyrillic at the bottom right, ""ЕТНОГРАФІЧНА КОЛЕКЦІЯ КРОВЕЦЬ""."
KYD1733,"A religious icon depicting a bearded man with a halo, wearing a red robe and a golden crown. He holds a staff and a cross. The background features a starburst pattern with gold and dark red colors. The image has visible signs of age and damage. Text at the bottom reads ""ЕТНОГРАФІЧНА КОЛЕКЦІЯ КРОВЕЦЬ""."
