image_id,caption
KYD1840,"A painting of a man in traditional attire sitting on a log, playing a large, round, red string instrument. He wears a dark hat, a white shirt, and blue pants. The background shows a landscape with a body of water, trees, and a distant village. The sky is painted in warm, muted colors. The painting has visible texture and some cracks. There is text in the bottom right corner: ""ЕТНОГРАФИЧНА КОЛЕКЦІЯ КРОВЕЦЬ""."
KYD1841,"A painted artwork depicting a woman in a red dress with a yellow collar, sitting on the ground next to a brown deer with antlers. The woman has a floral wreath in her hair and holds a bouquet of red flowers. She is wearing a red dress with a yellow apron and a yellow hat with flowers. The deer has a blue ribbon around its neck. The background shows trees and a fence. The sky is painted in warm colors. There is text at the bottom right that reads ""ЕТНОГРАФІЧНА КОЛЕКЦІЯ КРОВЕЦЬ"". The painting appears to be on a textured surface with visible paint smudges and damage."
KYD1842,"This is a colorful, folk-art style painting depicting a scene in a forest. Two figures are central: an older man with a white beard, wearing a white shirt and blue pants, is seated and playing a yellow lute. To his right, a man in a yellow tunic and blue pants, wearing a blue hat, is mounted on a red horse and holding a sword. The background features two trees with green leaves and red fruit, and several birds are perched on the branches. The ground is covered with flowers and foliage. The painting has a dark green background and shows visible signs of wear and tear. There is text in the bottom right corner that reads ""КРОВЕЦЬ"" and ""ЕТНОГРАФІЧНА КОЛЛЕКЦІЯ""."
KYD1843,"A colorful folk art painting on a yellow background. A stylized, orange bird with a red comb and black and white patterned wings is the central figure. It is surrounded by flowers in red, dark blue, and orange, with green leaves and stems. The painting has a decorative, folk-art style. A watermark at the bottom reads ""ЕТНОГРАФІЧНА КОЛЕКЦІЯ КРОВЕЦЬ"". The painting appears to be on paper with visible texture and some minor damage."
KYD1844,"A painted folk art piece featuring a colorful peacock surrounded by red flowers and green leaves on a light-colored, aged background. The peacock has a yellow body, a green and blue patterned tail, and a red crest. The flowers are stylized with red petals and black outlines. The artwork is on a textured, off-white surface with visible creases and discoloration. A watermark at the bottom reads ""ЕТНОГРАФІЧНА КОЛЕКЦІЯ КРОВЕЦЬ"" with a geometric symbol."
KYD1845,"This is a damaged, aged painting on wood depicting a rural scene. Three figures are visible: a man in a grey shirt and trousers stands on the left, looking up at a man on a horse in the center. The man on the horse wears a blue coat and a red hat, holding a rifle. To the right, a woman in a blue dress and white blouse stands near a wooden fence, holding a rope. In the background, there are houses with thatched roofs and a church with domes. The sky is a pale blue with clouds. The painting shows visible cracks and peeling paint. Text is visible at the bottom and right: ""ЕТНОГРАФІЧНА КОЛЕКЦІЯ КРОВЕЦЬ"" and ""СТАРІЙ БАТЬКО ІДЕ РЯДОМ,"" with the artist's signature ""С. К. К."" at the bottom right."
KYD1846,"A portrait of a man with a mustache, wearing a dark jacket and a patterned neckerchief. The background is dark and textured. The painting is on canvas with visible texture and some white speckles. In the bottom left, there is a signature ""J.M. 1937 р. 31ш."" and in the bottom right, a logo for ""ЕТНОГРАФИЧНА КОЛЕКЦІЯ КРОВЕЦЬ""."
KYD1847,"A portrait of a young woman with dark hair, wearing a red headscarf and a white blouse with red trim. She is looking directly at the viewer. The background is dark and textured. There is a watermark in the lower right corner that reads ""ЕТНОГРАФИЧНА КОЛЕКЦИЯ КРОВЕЦЬ"" with a logo. The painting appears to be on canvas and shows signs of age and wear, including chipped paint and a darkened background."
KYD1848,"A painted scene depicts a man and woman in traditional folk attire, standing by a well. The man, wearing a fur hat, embraces the woman as she looks up at him. A horse stands nearby, drinking from a stream. In the background, there are houses, trees, and a windmill. The foreground shows red berries and a wooden bucket. The image has visible damage and a watermark in the bottom right corner that reads ""ЕТНОГРАФІЧНА КОЛЕКЦІЯ КРОВЕЦЬ""."
KYD1849,"A painting of a woman in traditional folk attire, sitting at a table. She has dark hair in a braid, wears a white blouse with red embroidery and a red skirt. She is resting her chin on her hand. In the background, there is a white house with a thatched roof, a field of wheat, and a few chickens. A vase with flowers sits on the table. The painting shows visible cracks and wear. Text at the bottom right reads ""ЕТНОГРАФІЧНА КОЛЕКЦІЯ КРОВЕЦЬ""."
KYD1850,"This is an oil painting depicting a rural scene with several figures and a cart. The figures are dressed in dark clothing, and one person is standing near the cart. The background is a dark, textured green. The painting shows visible brushstrokes and some cracking. There is a watermark in the bottom right corner that reads ""ЕТНОГРАФІЧНА КОЛЕКЦІЯ КРОВЕЦЬ""."
KYD1851,"A painting of a woman with red hair, wearing a dark dress and a light-colored shawl, standing in a dimly lit, textured interior. She holds a small object in her arms. The background is a rough, earthy wall. The painting has visible brushstrokes and appears aged. A watermark at the bottom reads ""ЕТНОГРАФІЧНА КОЛЕКЦІЯ КРОВЕЦЬ""."
KYD1852,"A portrait of a man with dark hair, wearing a dark jacket and a light-colored, possibly yellow, collared shirt. The background is a textured, dark, and weathered surface. The painting appears to be on canvas, showing signs of age and wear. There is a watermark at the bottom right that reads ""ЕТНОГРАФІЧНА КОЛЕКЦІЯ КРОВЕЦЬ"" with a logo. The man is looking directly at the viewer."
KYD1853,"A vertical oil painting depicting a forest scene with a stream flowing through it. The painting features lush green trees and foliage, with a light-colored sky visible in the background. The stream is surrounded by grass and reeds. The painting has visible signs of age and damage, including cracks and fading. At the bottom, there is text in Cyrillic script: ""ЕТНОГРАФІЧНА КОЛЕКЦІЯ КРОВЕЦЬ""."
KYD1854,"A vertical painting depicts a lush, green landscape with a winding stream flowing through a forested area. A small house with a thatched roof is visible in the distance, nestled among the trees. The sky above is filled with large, fluffy clouds. The foreground features vibrant green grass and wildflowers along the stream. The painting shows signs of age and wear, with visible cracks and damage on the surface. At the bottom, there is a watermark that reads ""ЕТНОГРАФІЧНА КОЛЕКЦІЯ КРОВЕЦЬ""."
KYD1855,"This is a weathered, painted artwork depicting three figures in traditional attire. On the left, an older man with a mustache sits playing a large, round-necked string instrument, possibly a lute or a balalaika. In the center, a woman stands with her hands on her hips, wearing a red coat over a dark dress and a patterned head covering. On the right, a man in a white shirt and dark trousers leans against a wooden fence. The background shows a simple outdoor setting with a building and trees. The painting is visibly damaged with cracks and tears. In the bottom right corner, there is a watermark that reads ""ЕТНОГРАФИЧНА КОЛЕКЦІЯ КРОВЕЦЬ""."
KYD1856,"This is an oil painting depicting a rural landscape. In the foreground, two figures stand on a muddy bank by a river. One figure, wearing a dark vest and white head covering, stands with a staff. To the right, a man is in a cart pulled by two oxen, partially submerged in the water. In the background, there are several houses with red roofs and trees, set against rolling hills under a cloudy sky with yellow light. The painting is signed ""КРОВЕЦЬ"" in the bottom right corner."
KYD1857,"A colorful painting depicts four people in traditional folk attire in a rural landscape. A man in a brown coat and red sash stands on the left, smoking a pipe. Another man sits on a tree stump, holding a red object. Two women stand near a tree; one wears a red and white dress with floral patterns, and the other wears a red and blue dress. A small yellow-roofed hut is visible in the background. The scene is set in a field with trees and flowers under a sunset sky. Text in the bottom right corner reads ""ЕТНОГРАФІЧНА КОЛЕКЦІЯ КРОВЕЦЬ"" and ""Приходите свататесь Мы не будем прятаться""."
KYD1858,"A stylized painting depicting a couple in traditional attire. The man wears a black fez and a light-colored jacket, while the woman wears a red dress and a patterned shawl. They are standing near a horse, with a small house and a church in the background. The foreground features large red flowers. The sky is blue. There is text in the bottom right corner: ""ЕТНОГРАФІЧНА КОЛЕКЦІЯ КРОВЕЦЬ"". The artwork appears to be made of paper or a similar material, with visible brushstrokes and some areas of damage."
KYD1859,"A painted artwork depicting two figures in traditional attire with a horse. The figure on the left is a woman with long dark hair, wearing a red and white dress with floral patterns, holding a striped basket. The figure on the right is a man in a straw hat and a white shirt with a red scarf, standing beside the horse. The horse is dark brown with a yellow mane and tail, and is adorned with a red and yellow harness. The background shows trees, including birch trees, and the ground is covered with red flowers. The painting has visible cracks and wear. A watermark in the bottom right corner reads ""ЕТНОГРАФІЧНА КОЛЕКЦІЯ КРОВЕЦЬ""."
KYD1860,"A painted portrait of a man with dark hair and a mustache, wearing a dark robe with a red-orange sash. He is holding a small object in his hands. The background is a textured, dark green surface. The painting is weathered and damaged. Text in the lower right corner reads ""ЕТНОГРАФІЧНА КОЛЕКЦІЯ КРОВЕЦЬ 1914 р. В.А. БІЛЕНЬ г. Лубкі""."
KYD1861,"A painted portrait of a woman with a white headscarf, wearing a dark green garment. The background is a textured, dark green surface. The painting shows visible signs of age and wear, including cracks and paint peeling. The image has a watermark at the bottom right that reads ""ЕТНОГРАФІЧНА КОЛЕКЦІЯ КРОВЕЦЬ"" with a logo."
KYD1862,"A painting depicting a rural scene with a couple embracing in the foreground. The man wears a white shirt and a grey hat, while the woman wears a white dress with a colorful checkered skirt and a blue top. They are standing near a wooden fence. In the background, there is a thatched-roof house, a dirt path, and a woman in traditional attire walking away. The setting is lush with trees, flowers, and greenery. The painting shows signs of age, with visible cracks and peeling paint. In the bottom right corner, there is text in Cyrillic: ""ЕТНОГРАФІЧНА КОЛЕКЦІЯ КРОВЕЦЬ""."
KYD1863,"A portrait of a man with a mustache and a receding hairline, wearing a dark jacket over a white shirt with red and gold embroidery. The background is a textured, muted green. The painting shows signs of age and wear. A watermark in the bottom right corner reads ""ЕТНОГРАФІЧНА КОЛЕКЦІЯ КРОВЕЦЬ""."
KYD1864,"A portrait of a woman with dark hair, wearing a dark vest over a floral-patterned blouse and multiple beaded necklaces. She is looking directly at the viewer. The background is a textured, light brown wall. There is a watermark in the lower right corner that reads ""ЕТНОГРАФИЧНА КОЛЕКЦІЯ КРОВЕЦЬ"" with a logo. The painting appears to be on canvas and shows signs of age and wear."
KYD1865,"A painted portrait of a man with a mustache, dark hair, and a red collar over a white shirt with a floral pattern. He wears a dark coat. The background is dark and textured. A watermark is visible in the lower right corner."
KYD1866,"A painted still life of a basket filled with flowers. The basket has a brown and gold checkered pattern. The flowers include red poppies, red and white daisies, and small white and pink blossoms. The background is a textured blue-green. There is text in the bottom right corner: ""ЕТНОГРАФИЧНА КОЛЕКЦІЯ КРОВЕЦЬ""."
KYD1867,"This is an oil painting depicting a rural scene with two figures. A man in a white shirt and a dark hat holds a long wooden stick, standing behind a large haystack. A woman in a white blouse and a red plaid skirt stands beside the haystack, holding a long wooden pole. She wears a floral headpiece and a necklace. A wooden barrel is on the ground near her. The background shows a wide, open landscape under a pale sky. The painting has visible texture and some damage. There is text at the bottom right: ""ЕТНОГРАФІЧНА КОЛЕКЦІЯ КРОВЕЦЬ""."
KYD1868,"A painting depicts a couple in traditional folk attire standing in a rural garden. The woman wears a red dress with floral patterns, a necklace, and a floral wreath in her hair. The man wears a white shirt, a red sash, a blue apron, and a light-colored hat. They are standing near a well with a wooden bucket. In the background, there are several thatched-roof houses, trees, and a path with another woman in traditional clothing walking away. The painting is in the style of folk art. There is text in the bottom right corner: ""ЕТНОГРАФИЧНА КОЛЕКЦІЯ КРОВЕЦЬ""."
KYD1869,"A painting depicting a rural landscape with a dirt path, a white horse, and two figures. One figure in a red coat stands near a wicker fence, while another sits beside it. The background features trees, a few houses, and a cloudy sky. The painting is on canvas with visible texture and some damage. Text in the bottom right corner reads ""ЕТНОГРАФІЧНА КОЛЕКЦІЯ КРОВЕЦЬ"" and ""Ггора 1970."""
KYD1870,"A painted landscape depicts two houses with red roofs and white walls, set on either side of a river. A wooden boat rests in the water, and several swans are swimming in the river. A woman in a red skirt and white blouse stands on a path on the right. The background features green trees, tall cypress trees, and a sky with birds. The painting is on a wooden surface with visible grain and some damage. Text in the bottom right corner reads ""ЕТНОГРАФИЧНА КОЛЕКЦІЯ КРОВЕЦЬ""."
KYD1871,"This is an oil painting on canvas depicting a rural scene. A thatched-roof house is in the background, with a wooden fence in the foreground. Three figures are visible: a woman in a white shirt and dark skirt stands on the left, a man and a woman in traditional folk clothing stand together on the right, and another woman in a white shirt and dark skirt stands near the fence. In the foreground, two buckets and a wooden barrel are on the ground. The painting shows signs of age and wear. There is text in the bottom right corner: ""ЕТНОГРАФИЧНА КОЛЕКЦИЯ КРОВЕЦЬ""."
KYD1872,"A painting depicts a rural scene with two figures on a dirt path. A man in a red coat and black hat stands beside a black horse, holding a bouquet. A woman in a white blouse and pink skirt stands next to him. In the background are green fields, several houses with thatched roofs, and a large tree. The sky is light blue with some clouds. The painting is signed ""ІХАВ КОЗАК ЗАДУНАЙ"" at the bottom left. A logo for ""ЕТНОГРАФІЧНА КОЛЕКЦІЯ КРОВЕЦЬ"" is in the bottom right corner. The painting shows visible signs of age and wear."
KYD1873,"A painting of a rural scene with a woman in traditional attire standing in front of a house with a thatched roof. She is wearing a red dress and a white blouse, and has a floral headpiece. The house has a small window and is surrounded by a fence and wildflowers. In the background, there are other houses and trees. The sky is overcast. The painting is on a wooden surface with visible cracks and damage. There is text in the bottom right corner that reads ""ЕТНОГРАФІЧНА КОЛЕКЦІЯ КРОВЕЦЬ""."
KYD1874,"A colorful painting depicts a village scene with a prominent church featuring multiple onion domes, some green and some blue, with golden crosses. The church is surrounded by lush green trees and flowering bushes. In the foreground, a dirt path leads through a wooden fence to a small house with a red roof on the left and a blue roof on the right. Two figures in traditional clothing walk along the path. In the background, a few other figures are visible. The sky is a pale blue. The painting has visible signs of age and wear. In the bottom right corner, there is text in Cyrillic script: ""ЕТНОГРАФІЧНА КОЛЛЕКЦІЯ КРОВЕЦЬ""."
KYD1875,"A portrait of a young boy with short brown hair and blue eyes, wearing a white shirt with a blue and brown embroidered collar. The background is a plain, textured, light gray. The painting shows visible cracks and wear, particularly on the skin and fabric. There is text in the bottom right corner: ""ЕТНОГРАФІЧНА КОЛЕКЦІЯ КРОВЕЦЬ""."
KYD1876,"A portrait of a man in a dark jacket and a white shirt with a colorful embroidered tie. The image is on a textured, aged, dark background with visible cracks and peeling paint. The man has short dark hair and is looking forward. There is text in the bottom right corner: ""ЕТНОГРАФІЧНА КОАРКІЛІ КРОВЕЦЬ""."
KYD1877,"A painted folk scene depicts three figures in traditional attire. A man in a blue skirt and orange shirt holds a horse's reins, a woman in a white blouse and green skirt stands beside him, and a man in a white shirt and red hat sits on a horse. They are in a rural setting with a wooden fence, trees, and a house in the background. The painting shows signs of age and wear. Text in the bottom right corner reads ""ЕТНОГРАФІЧНА КОЛЕКЦІЯ КРОВЕЦЬ""."
KYD1878,"This is a painting of a rural landscape. A white house with a grey roof and orange shutters is the central focus, surrounded by a white picket fence and lush greenery. The scene includes trees, a small pond with lily pads and a white swan, and a red boat. The sky is a muted pink and grey. There is a watermark in the bottom right corner that reads ""ЕТНОГРАФИЧНА КОЛЕКЦІЯ КРОВЕЦЬ"". The painting shows signs of age and damage, particularly on the left side where there are large patches of dark, possibly burnt, material."
KYD1879,"This is a painting of a serene, natural landscape. A calm body of water, likely a pond or small river, is the central feature, with two white swans swimming in the middle. The scene is surrounded by lush green trees, including birch trees with their distinctive white bark on the right and tall, brown-trunked trees on the left. The background shows a distant, winding path through a field under a pale sky. The foreground includes grassy banks, reeds, and flowering bushes. A small wooden stump is visible on the left bank. The painting has a soft, impressionistic style with visible brushstrokes. In the bottom right corner, there is a watermark that reads ""ЕТНОГРАФІЧНА КОЛЕКЦІЯ КРОВЕЦЬ""."
KYD1880,"A painting depicting a woman in a blue dress with red roses in the foreground, standing by a river. In the background, there are two houses on a hill, trees, and a sky with birds. The painting has visible signs of age and wear. There is text in the bottom right corner that reads ""ЕТНОГРАФІЧНА КОЛЕКЦІЯ КРОВЕЦЬ""."
KYD1881,"This is a painting depicting a rural landscape. In the foreground, two women stand by a wooden well, and a man is near a pond with several ducks. A flock of birds flies in the sky. In the background, there are trees, houses, and a windmill. The painting has visible signs of age and damage. There is text in the bottom right corner that reads ""ЕТНОГРАФІЧНА КОЛЕКЦІЯ КРОВЕЦЬ""."
KYD1882,"A painting of a woman in traditional folk attire, walking on a dirt path. She is carrying a wooden bucket on her shoulder and a smaller basket in her left hand. She is barefoot and wears a red vest over a white blouse, a long skirt, and a blue headband. The background shows trees, a blue sky, and a small house. The painting is in the style of an oil on canvas. There is text at the bottom right that reads ""ЕТНОГРАФІЧНА КОЛЕКЦІЯ КРОВЕЦЬ""."
KYD1883,"This is an oil painting depicting a rural village scene. In the foreground, a large green field with a dark shadow is visible. A woman in a red skirt and white blouse stands in the middle ground, near a dirt path. To the right, a white house with a thatched roof stands next to a large green tree. In the background, another smaller building with a thatched roof is visible. A horse is standing near the left side of the scene. Two small figures are on the grass in the lower left. The painting has a textured surface. In the bottom right corner, there is a watermark that reads ""ЕТНОГРАФІЧНА КОЛЕКЦІЯ КРОВЕЦЬ"" and a signature in the bottom left corner."
KYD1884,"This is an oil painting depicting a rural scene with a thatched-roof house and several figures. The house is white with a large, round, brown thatched roof. In the foreground, three figures stand on a dirt path: two adults and a child. To the right, a person sits near the house. The background features trees and a pale blue sky. The painting shows visible brushstrokes and some damage, including a vertical crack in the center. In the bottom right corner, there is a logo and text in Ukrainian: ""ЕТНОГРАФІЧНА КОЛЕКЦІЯ КРОВЕЦЬ""."
KYD1885,"A painting depicting a group of people in a rural setting. On the left, a man in a red shawl and blue pants kneels, holding a small object. Next to him, an older man in a white robe sits on a bench. In the center, a woman in a dark dress and red headscarf holds a red object, while a man in a white shirt stands beside her. A young boy in a white shirt stands nearby. A table with food and drink is in the foreground. A wooden hut is visible in the background. The painting is signed ""КРОВЕЦЬ"" and has a watermark ""ЕТНОГРАФІЧНА КОЛЕКЦІЯ""."
KYD1886,"This is an oil painting depicting a rural scene with several figures. In the foreground, a woman in a white blouse and dark skirt stands on a wet, muddy road, holding a long stick. To her right, two horses are standing, one dark and one white. Behind them, a cart pulled by a white horse carries several people. A small child stands on the right side of the road. In the background, there is a simple house with a thatched roof. The sky is overcast. The painting is signed ""А. Левин"" in the lower right corner. There is a watermark in the lower right corner that reads ""ЕТНОГРАФИЧНА КОЛЕКЦІЯ КРОВЕЦЬ""."
KYD1887,"A small oil painting depicting a rural scene. A woman in traditional attire stands on a muddy bank, holding a metal bucket. In the background, a man rides a horse across a flooded field. A small village with thatched-roof houses is visible in the distance, surrounded by trees. The sky is overcast. The painting shows visible brushstrokes and some wear. A watermark in the bottom right corner reads ""ЕТНОГРАФІЧНА КОЛЕКЦІЯ КРОВЕЦЬ""."
KYD1888,"This is a painting depicting a rural landscape with several houses, trees, and a body of water. The houses have red roofs and white walls with red shutters. A person in a blue dress stands on a path in the foreground. Several white swans are on the water. The background features tall trees and a sky with birds. The painting has visible signs of wear and tear. There is text in the upper left corner and a watermark in the lower right corner."
KYD1889,"This is an oil painting on canvas depicting a rural landscape. A dirt path winds through green hills, leading to a small white house with a thatched roof. A pond with several white swans is in the foreground. Trees and foliage are visible on the hillsides. The sky is a pale, overcast color. There is a watermark in the lower right corner that reads ""ЕТНОГРАФИЧНА КОЛЕКЦІЯ КРОВЕЦЬ"". The painting shows visible texture and signs of age."
KYD1890,"This is a small, weathered painting of a rural landscape at dusk. A dirt path winds through a green field, leading towards a small house with a red roof. The scene is framed by trees, including tall, slender cypress-like trees on the left and a large, dense tree on the right. The sky is a blend of pale blue and warm orange-yellow, with a bright sun visible on the right. The painting shows signs of age, with visible cracks and scratches on the surface. In the bottom right corner, there is a watermark that reads ""ЕТНОГРАФИЧНА КОЛЕКЦІЯ КРОВЕЦЬ""."
